"","id","comments"
"1","s1_0001","everyone telling watch severance nobody tryna watch apple"
"2","s1_0002","can quite explain show severance captivating far"
"3","s1_0003","full body clench entire second half severance season finale grimacing face one exhilarating tv experiences long time just perfect conclusion already stand first season"
"4","s1_0004","one greatest movie series ever seen"
"5","s1_0005","severance apple tv delivered best season finale seen years fire"
"6","s1_0006","severance apple fire"
"7","s1_0007","thank apple tvplus inviting friday night well capture inside look season finale wrap party severance amazingly talented ben stiller patricia arquette judd apatow check photos video instax"
"8","s1_0008","holy hell severance show like whoa"
"9","s1_0009","thing topped ending perfect show friends tonight somehow season premiere severance show us god show amazing best anniversary two hearts two hearts"
"10","s1_0010","finished binging severance um weird lot questions answers hell cliffhanger hooked season still weird tho"
"11","s1_0011","can tell just watched season finale severance"
"12","s1_0012","weird computers claustrophobic hallways severance"
"13","s1_0013","notebook severance obsessed show need talking severance takes"
"14","s1_0014","severance watch now apple tv plus"
"15","s1_0015","severance season finale ending raged core"
"16","s1_0016","severance workplace brutality sci fi neither worker power vox"
"17","s1_0017","show good severance"
"18","s1_0018","season finale severance insane maybe one greatest ever"
"19","s1_0019","binged severance last day believe season ended like confident another episode two watch order finish devastated"
"20","s1_0020","severance incredible tv episodes now apple tv per month settled new place time new show consider trying downside finale major cliffhanger know going"
"21","s1_0021","anyone read short science fiction probably guess really like severance prestige tv thoughtful well slick well acted like season forthwith"
"22","s1_0022","severance unbelievably stupidly well done art direction casting cinematography production design every frame show impeccable directorial cohesion attention detail"
"23","s1_0023","severance best show ever made"
"24","s1_0024","omg severance can remember last time reveal tv show made gasp good"
"25","s1_0025","waiting season severance going torture best show tv long time"
"26","s1_0026","season finale severance one best episodes tv ever watched masterful show garner succession level praise severance"
"27","s1_0027","anyone misses watch severance everything perfection best sy fy show seen unmatched severance"
"28","s1_0028","severance season look ratings"
"29","s1_0029","just season can categorically say severance season better breaking bad season"
"30","s1_0030","agree everyone else say first season severance fantastic hopefully can avoid westworld problem keep story interesting season"
"31","s1_0031","apple tv almost million active subscribers time get rock living ted lasso coda severance pachinko"
"32","s1_0032","wow just wow severance incredible season apple tvplus"
"33","s1_0033","also severance apple tv best show right now"
"34","s1_0034","started show severance far interesting really sure think just yet"
"35","s1_0035","severance great season great finale"
"36","s1_0036","furiously googling possibility becoming severed can make innie deal next however long season severance comes matter fact will stay severed whole season can binge"
"37","s1_0037","severance amazing season finale though heart pumping whole time"
"38","s1_0038","best show tv years severance"
"39","s1_0039","really great scifi recently severance feature series respectively incredibly gripping fresh happy severance got renewed"
"40","s1_0040","just yelling tv credits started rolling now know season finale woozy face flushed face see coming severance"
"41","s1_0041","just watched season finale severance exploding head dude unbelievable work heart still racing bravo whole team stoked see season two coming can get one pieces painted"
"42","s1_0042","season finale severance crazy astonished face hyped show"
"43","s1_0043","severance best show right now finale"
"44","s1_0044","just watched episode severance tvtime"
"45","s1_0045","season severance brilliant example sci fi can create space ethical reflection structural conditions limit ability flourish add sci fi christian ethics dream course"
"46","s1_0046","season finale severance amazing one best episodes tv show seen"
"47","s1_0047","severance season finale wild literally screamed end"
"48","s1_0048","watch severance apple tv"
"49","s1_0049","just spent day binge watching severance wow fantastic clapping hands need season now please"
"50","s1_0050","severance finale though omg exploding head need season immediately"
"51","s1_0051","severance finale series solid"
"52","s1_0052","severance apple tv wild"
"53","s1_0053","jesus christ severance apple tv freaking good"
"54","s1_0054","severance director ben stiller cast taking workplace comedy genre flipping head contenders tv"
"55","s1_0055","ok spent day binging severance def took way long get going big shock ending kept hearing actually kind predictable overall season gets great cast though"
"56","s1_0056","watch severance lets see"
"57","s1_0057","severance may excited tv show seen year"
"58","s1_0058","just finished watching severance blown way like typical thriller story still draws writing cast great sincerely hope gets renewed"
"59","s1_0059","need season severance now"
"60","s1_0060","season finale severance"
"61","s1_0061","severance finale got like wtff haven seen show yet really want included conversation"
"62","s1_0062","severance may just pulled one best season finales cliffhangers seen time awesome watch"
"63","s1_0063","think people talking last days ptolemy grey severance"
"64","s1_0064","going need second season severance drop sooner rather later cc"
"65","s1_0065","severance apple tv fire"
"66","s1_0066","everyone loved severance watch calls apple tv"
"67","s1_0067","severance sick show unexpected turns twists deep manipulation writers definitely normal people"
"68","s1_0068","severance season finale easily top"
"69","s1_0069","question severance actually need talk"
"70","s1_0070","best way can describe series severance old stanley kubrick young charlie kaufman teamed created office drama severance"
"71","s1_0071","severance first season wonderfully tense workplace horror story via"
"72","s1_0072","let know anyone wants hook dad apple can watch severance"
"73","s1_0073","invasion fantastic beautiful show highly recommended time watch severance apple tv may worth keeping"
"74","s1_0074","just finished episode severance addicting hell visuals among cleanest effective seen show long mesmerized whole time episode"
"75","s1_0075","every episode watched far intense captivating time log apple tv like navigating nightmare pretty offputting see show still forge ahead severance"
"76","s1_0076","severance finale amazing sure enjoyed first season like since westworld fantastic job cast"
"77","s1_0077","dang severance thought provoking series long long time finale"
"78","s1_0078","just came across show called severance binged entire first season pleading face"
"79","s1_0079","watching severance apple app"
"80","s1_0080","just finished severance season one absolutely bonkers series yet see watch now everyone amazing uncomfortably creepy deserves win awards writers creators"
"81","s1_0081","truth severance"
"82","s1_0082","job well done first season edge seat whole time severance"
"83","s1_0083","like severed season please thank severance"
"84","s1_0084","severance just really dope concept show execution making way towards finale just like way done impressive"
"85","s1_0085","dude just watched season finale severance star struck exploding head black heart"
"86","s1_0086","severance apple tv bought apple product last year get free subscription"
"87","s1_0087","severance absolute banger first season holy cow"
"88","s1_0088","good severance season finale can wait season"
"89","s1_0089","severance show"
"90","s1_0090","apple tv finding stride severance wecrashed slam dunks"
"91","s1_0091","just plowed entire first season severance today holy smokes good television severance"
"92","s1_0092","severance best show far"
"93","s1_0093","fell asleep watching episode severance woke middle episode two precisely lumon wanted grimacing face"
"94","s1_0094","severance spectacular need season two asap"
"95","s1_0095","severance another level season finale one best episodes television ever seen waffle parties"
"96","s1_0096","severance far best thing watched years nuance tension addicting master craft know will able wait till season"
"97","s1_0097","anyone else watching severance appletv"
"98","s1_0098","will say love vibe severance sure check devs totally watched show hulu couple years back"
"99","s1_0099","severance easily one best shows ever seen can freaking wait season"
"100","s1_0100","severance ah need next season now"
"101","s1_0101","severance man watch show"
"102","s1_0102","okay irving achieved nothing season finale severance mark told sister helly tried outing company party irving stared burt door"
"103","s1_0103","premise show apple tv called severance lol get brain procedure memories separated work personal lives consciousness basically switched hours day wake leave work"
"104","s1_0104","way screaming severance season finale omg"
"105","s1_0105","good show apple tv killing lasso morning show severance"
"106","s1_0106","severance good hurry season"
"107","s1_0107","think held breath entire season finale severance"
"108","s1_0108","severance best new tv show since ted lasso chewed every nail watching season finale highly recommend waffleparty"
"109","s1_0109","severance best show television"
"110","s1_0110","nobody talking tv show severance"
"111","s1_0111","omg severance backed ending rewatched times really take long find another show good breaking bad bf lying proud"
"112","s1_0112","wholey mother lover severance season finale got already anxiety season lfg astonished face dizzy face dizzy"
"113","s1_0113","watching severance due mark talking positively show great puts fear big companies will take lumon good example follow"
"114","s1_0114","severance just pulled one best season finales ever seen masterpiece show"
"115","s1_0115","severance wow lynchian minimalist phycological sci fi one kind show well done deeply strange just watched whole season still perplexed fascinated outta wow severance scifi thriller apple tv"
"116","s1_0116","severance favorite show time"
"117","s1_0117","true severance amazing one best best season finales ever seen"
"118","s1_0118","control tv show severance remedy consult show brilliant please"
"119","s1_0119","also idk love severance think perfect also feel weird saying show recent memory good first season haven watched tv feels like recency bias"
"120","s1_0120","woah gonna need second season severance immediately"
"121","s1_0121","hahahahaha exact freaking opposite slate severance finale apple tv satire office life makes case going back work"
"122","s1_0122","especially funny re severance lots details worth decoding sitting just ending season finale one bit pretty clear"
"123","s1_0123","glad people caught severance truly one best tv shows right now wait season think lumen future"
"124","s1_0124","god severance season finale one best ever seen exploding head"
"125","s1_0125","watching show super mystery sci fi nature mesmerized storytelling coming thoughts theories walk goat room starting back severance"
"126","s1_0126","need severance like asap start filming next season now please need new episode"
"127","s1_0127","look watch lot tv movies really just everything mad latest episode severance season finale glad series finale need slew vignettes harmony perspective season released gah"
"128","s1_0128","severance season season finale illegal"
"129","s1_0129","perfectly insane ending season severance can wait season"
"130","s1_0130","well severance season one haven felt kind unmoored since first season ended wtf now"
"131","s1_0131","severance intriguing ostensibly corporate drone life wonder actors related people whose job literally show work act like different person also gather show folks want go back office"
"132","s1_0132","start many shows give just draw severance amazing never want end keep wait next season clapping hands"
"133","s1_0133","dang dang dang great severance just finished season glad season green kit smiling face smiling eyes thumbs"
"134","s1_0134","severance finale set apple tv show season"
"135","s1_0135","haven go watch severance apple tv seriously one best seasons tv seen long time riveting start finish can wait"
"136","s1_0136","per usual starting amazing series late game upside can binge watch downside will mute things severance see spoilers just started today feeling going late nights glued screen television thanks"
"137","s1_0137","watched apple tv recently ted lasso severance shrink next door wolfwalkers mythic quest jon stewart"
"138","s1_0138","season finale severance stressing"
"139","s1_0139","watched season one severance highly recommended thinking can think one thing adam scott awesome looked filmography learned like second ever role apparently star trek first contact"
"140","s1_0140","show severance filmed previous home beacon ny blinking beacon traffic light makes guest appearance"
"141","s1_0141","time talk season finale severance without spoiling thinking face"
"142","s1_0142","bonkers people will post kind effusive praise severance deeply mid servant really currently running show means anything right now"
"143","s1_0143","wait season severance season finale short many cliffhangers loudly crying face"
"144","s1_0144","severance star britt lower learned helly big finale twist"
"145","s1_0145","severance season drop weary face"
"146","s1_0146","season finale severance officially summoned reemergence meme"
"147","s1_0147","okay severance season finale good now pissed wait season get answers"
"148","s1_0148","apple tv severance biggest cultural phenomenon yet ably described writer given atribution also deserves acolades just much happening though suspect much left audio description script"
"149","s1_0149","someone thoroughly enjoyed black mirror season severance slow starter pulled checking reddit sites clues episode later season great show"
"150","s1_0150","haven watched severance right hyperbole series incredible"
"151","s1_0151","counting station eleven show severance easily best tv show goodness"
"152","s1_0152","us watched severance apple decided renew five us just left season one finale"
"153","s1_0153","just blown away severance season finale feel manipulated whole thing one big anxiety attack like asked entire episode built anticipation towards single moment just ended"
"154","s1_0154","remarkable first season completely knocks park every level praise keir man light skin tone laptop computer severance"
"155","s1_0155","far really enjoying severance show intro theme music quite good"
"156","s1_0156","severance dang good season tv time"
"157","s1_0157","whole tl talking severance hesitant start watching also apple said can subscribe service incident one stores spill one drink mac books trying run longer welcome face rolling eyes"
"158","s1_0158","get apple tv watch severance"
"159","s1_0159","long wait season severance loudly crying face"
"160","s1_0160","severance apple tv just ended amazing first season thrilling finale love"
"161","s1_0161","yeah gonna need season severance like now"
"162","s1_0162","looking episodes severance exploding head"
"163","s1_0163","still taking finale terrific debut show storyline severance"
"164","s1_0164","masterpiece first season severance raising hands"
"165","s1_0165","severance really nailed every psychological horror beat can think subtle ways possible show"
"166","s1_0166","processing severance"
"167","s1_0167","severance can say wow little pissed wow season better hurry"
"168","s1_0168","never much anxiety adrenaline watching season finale anything severance really wild concept amazing show"
"169","s1_0169","apple tv great shows severance"
"170","s1_0170","watch season finale severance hella excited last episode ending flushed face"
"171","s1_0171","literally going burn hole brain season two released severance"
"172","s1_0172","police car light psa police car light get free trial apple tv already one watch severance will change life sparkles"
"173","s1_0173","ending season severance literally control can believe wait see rest"
"174","s1_0174","severance season finale crazy wow"
"175","s1_0175","severance apple tv fantastic"
"176","s1_0176","severance apple tv good"
"177","s1_0177","whoa severance season finale intense whew come season two"
"178","s1_0178","years essential worker severance apple saying many things work life balance workplace stress able put words everything unfolded irl"
"179","s1_0179","know show good wife asks okay severance"
"180","s1_0180","friend watching severance really friends seriously watch can explain show good watch just know need watch lot good tv best"
"181","s1_0181","severance season finale amazing can wait till next season"
"182","s1_0182","severance fans last night season finale can wait til season"
"183","s1_0183","literally freaking season finale severance"
"184","s1_0184","just watched severance apple plus pleasantly surprised awesome"
"185","s1_0185","now episodes severance watch season"
"186","s1_0186","ted lasso afterparty little america severance apple tv becoming go streamer can miss television"
"187","s1_0187","severance answer new tv show loving"
"188","s1_0188","mesmerized show severance"
"189","s1_0189","watched ep season one finale severance recently announced show got renewed last minutes season finale definitely felt like show thought might get season two needed cram little feel good resolution"
"190","s1_0190","talking severance discord yesterday season finale bananas"
"191","s1_0191","glued screen entire duration severance finale trip now wait season"
"192","s1_0192","haven watch show miss star star star star"
"193","s1_0193","show severance call wedding"
"194","s1_0194","much dislike apple must admit apple tv fantastic shows severance"
"195","s1_0195","need next season severance right now thanks"
"196","s1_0196","season severance truly can come soon enough"
"197","s1_0197","omg show amazing can wait season severance"
"198","s1_0198","great follow read"
"199","s1_0199","hands stressful minutes life"
"200","s1_0200","severance fire can wait season"
"201","s1_0201","curiosity time face monocle shows currently watching just finished current seasons servant severance incredible recommend enough apple tv also watching halo moon knight"
"202","s1_0202","severance review series episode"
"203","s1_0203","watched first episode apple tv severance found main character entrance work strangely familiar looked location shoot worked bell labs record remember working"
"204","s1_0204","ending dare end face symbols mouth case anyone else wondering finished season severance smiling face"
"205","s1_0205","wow severance"
"206","s1_0206","season severance best season tv seen since season leftovers around brilliant filmmaking editing originality point finale"
"207","s1_0207","starting arrangement main title song severance great music incredible show"
"208","s1_0208","severance might one greatest season finales capping even better season severance"
"209","s1_0209","now starting season finale severance may live tweet reaction two will avoid specifics"
"210","s1_0210","interview severance casting director rachel tenner reveals challenging role cast apple tv series"
"211","s1_0211","severance season ends massive cliffhanger"
"212","s1_0212","season one severance amazing story tone cinematography performances good must watch"
"213","s1_0213","watch finale severance wild show"
"214","s1_0214","show orphan black levels great happy renewed wait going agony incredible finale severance"
"215","s1_0215","ok severance hands one best shows watched recently ever omg"
"216","s1_0216","apple tv literally chelsea service per month can shared among people incredible content like severance ted lasso pachinko slow horses coda eyes"
"217","s1_0217","severance season finale doozy"
"218","s1_0218","ready ending severance season coming"
"219","s1_0219","severance season finale tho"
"220","s1_0220","processing severance"
"221","s1_0221","severance best show seen years finale masterclass acting directing bravo"
"222","s1_0222","severance best new show year right"
"223","s1_0223","surely high praise calls music dance experience truly unbelievably brilliant show unlike anything else finale amazing can wait season severance"
"224","s1_0224","severance smash hit great storylines master brilliant cast love helly brit lower star thank outstanding series apple adam scott zachcherry turturro data refinement star star star star star"
"225","s1_0225","watch season finale severance second time brilliant please watch can discuss"
"226","s1_0226","heartfelt take show watch"
"227","s1_0227","severance finale set apple tv show season"
"228","s1_0228","can wait rep lumon merch sure show will radar much longer severance"
"229","s1_0229","severance finale set apple tv show season"
"230","s1_0230","new hbo max show tokyo vice severance knock socks good like lot"
"231","s1_0231","severance finale need season now"
"232","s1_0232","severance fans stressing bizarre love triangle ms casey gemma mark helly kiss feelings like going make us choose team helly team gemma equally stunning fire red heart zany face"
"233","s1_0233","just saw severance finale exploding head can wait season"
"234","s1_0234","feel like severance wanted last season west world hbo deep"
"235","s1_0235","severance season finale outstanding season haunting want throw around phrases like generation audrey hepburn lower sly piercing resonant already can wait season severance finale"
"236","s1_0236","ready season severance"
"237","s1_0237","apple tv get month free trial target watch severance"
"238","s1_0238","friend just said sever next season agree severance"
"239","s1_0239","think just watched best season finale dare say ever omg severance might seem slow first give chance wonder get finale will see perfectly written structured"
"240","s1_0240","please just let extra second season severance can part weird world love much"
"241","s1_0241","severance apple tv good show wtf"
"242","s1_0242","severance finished strong season ratings avg rating tvcharts severance"
"243","s1_0243","severance brilliant engaging series must watch can wait"
"244","s1_0244","season finale severance far insane cliffhanger season ever experienced"
"245","s1_0245","just finished season one severance"
"246","s1_0246","ah one best season finales seen can wait season grinning face sweat severance apple tv must watch"
"247","s1_0247","hooks severance amazing season finale cliff hanger perfect haven enjoyed tv like since first seasons lost mr robot"
"248","s1_0248","severance season finale right hushed face frowning face open mouth anguished face face open mouth astonished face flushed face"
"249","s1_0249","severance one best shows right now missing watching go watch now severance"
"250","s1_0250","severance finale one year best hours tv"
"251","s1_0251","severance great show"
"252","s1_0252","severance indeed amazing ted lasso favorite show two hearts"
"253","s1_0253","severance really good show kudos"
"254","s1_0254","really appreciating severance apple tv"
"255","s1_0255","severance finale great can wait see next season"
"256","s1_0256","severance brilliant show around show global survey mean jaw dropping brilliance apple tvplus severance severancefinale"
"257","s1_0257","severance one best tv series ever seen"
"258","s1_0258","wow season ender severance apple tv probably best cliffhanger ending ever seen edge seats"
"259","s1_0259","yes tense satisfying enough mad cliffhanger let tell anxiety issues tense nuanced careful pacing severance season finale perfect"
"260","s1_0260","innie outie decided need severance season asap get serious control vibes show big fan"
"261","s1_0261","plus star trek nfts severance"
"262","s1_0262","severance director ben stiller spills season one ended might get see season two"
"263","s1_0263","severance apple tv way"
"264","s1_0264","thank great birthday cake weekend severance"
"265","s1_0265","reit write"
"266","s1_0266","wow just watched severance season finale congratulations everyone involved show builds intrigue magnificent crescendo clapping hands medium skin tone clapping hands medium skin tone clapping hands medium skin tone"
"267","s1_0267","rd episode severance far show good struggling ignore children"
"268","s1_0268","severance season finale else re re rewatching whole thing give emmy"
"269","s1_0269","may widespread following ted lasso apple tv now crowning achievement drama category severance wrapped fantastic first season yesterday highly recommend"
"270","s1_0270","literally silver lining covid isolation discovering severance absolute belter first season especially finale"
"271","s1_0271","binge watched show severance last night well morning wild af"
"272","s1_0272","just say severance red apple tv phenomenal mind blowing season finale one coolest episodes tv seen since lost constant"
"273","s1_0273","watched severance need get one best season finales recent memory wife made incredible coveted egg bar celebrate last episode speaker playing defiant jazz great work"
"274","s1_0274","still thinking severance season finale can possibly wait season"
"275","s1_0275","need second season severance now loudly crying face"
"276","s1_0276","watched severance missing drop everything watch first season entirety now right now"
"277","s1_0277","season severance get soon enough"
"278","s1_0278","tv show severance"
