"","id","comments"
"2847","s2_1062","hereby request season severance one rare shows wife become equally enthralled every episode please"
"2848","s2_1063","severance season finale bad first lumon brings back mark wife dead kills someone kidnaps people repay mention even stay whole marching band recital mr milchick provided praisekier"
"2849","s2_1064","severance season good level season noticeable drop far concerned worry lost territory making go along care current plot less character decisions made little sense still good"
"2850","s2_1065","highly doubt legal side play show like severance lumon certainly hold mark torture gemma"
"2851","s2_1066","oh goodness episode severance might greatest tv show episode ever seen also infuriating now got wait another three years"
"2852","s2_1067","going severance procedure watch finale season might version seen thankfully"
"2853","s2_1068","good news severance fans"
"2854","s2_1069","surprise severance will returning third season severance apple tv"
"2855","s2_1070","mixed feelings finale severance season season whole felt tempers love drove plot forward particularly main storyline good small dose answers many mysteries going"
"2856","s2_1071","really great interview admire hell dan erickson knowing theorizing around severance can awkward still plowing forward without fan service mind instead serving story characters"
"2857","s2_1072","god love show finale severance"
"2858","s2_1073","outsider never seen severance never confusing show see clips tl just see people corporate clothing settings dancing colorful backgrounds idea wtf going"
"2859","s2_1074","sure prevalent theme severance season finale"
"2860","s2_1075","season finale severance just omfgskull"
"2861","s2_1076","severance season finale"
"2862","s2_1077","severance season finale really hit right balance answering lot lingering questions open importantly questions take shows lost breaking bad feels clear execs know going even dont"
"2863","s2_1078","watch severance finale thoughts"
"2864","s2_1079","season two finale severance learn cast"
"2865","s2_1080","season finale severance just omfgskull"
"2866","s2_1081","can watch severance season finale next week"
"2867","s2_1082","severance crushed season just give every award"
"2868","s2_1083","lot darker dystopian seen severance director ben stiller unpacks season finale invites season"
"2869","s2_1084","yea severance lost season"
"2870","s2_1085","love just much fan gwendoline christie gameof thrones fame severance got join show help craft pretty incredible character beware finale spoilers watch full conversation"
"2871","s2_1086","need something new severance"
"2872","s2_1087","season finale severance need government shut"
"2873","s2_1088","severance creator dan erickson ben stiller lumon cast unpack marching mayhem macrodata season finale"
"2874","s2_1089","show severance paley fest tonight dressed like mark will bullied venue honest will ben stiller throw tomato"
"2875","s2_1090","season two finale severance released learn watch show"
"2876","s2_1091","still finished season lowkey lose lot interest severance mark decided undo everything stay floor like ight man guess will finish whatever dude"
"2877","s2_1092","last night episode thepitt far better season severance"
"2878","s2_1093","excited see severance writers bring irving back season know show without broken heart"
"2879","s2_1094","severance season prediction someone activates glasgow block innies see work environment really live"
"2880","s2_1095","needs put season severance theaters hour marathon dead serious"
"2881","s2_1096","review reference classic seinfeld episode works"
"2882","s2_1097","apple tv formally renewed severance another season second season broke records watched series streamer apple tv said"
"2883","s2_1098","severance season two review"
"2884","s2_1099","one fan translated love show severance birthday jay ann lopez brought family friends world lumon industries season finale approached"
"2885","s2_1100","cold harbor outdoes season finale feels like beginning something thrilling"
"2886","s2_1101","one pandemic two historic hollywood strikes three year gap seasons later apple tv confirmed third season friday"
"2887","s2_1102","hoping wait seasons stretch three years time huh"
"2888","s2_1103","severance schmigadoon servant three apple tv shows watch already spread thin far many streaming services many draws rather spend money acorn amc connected media"
"2889","s2_1104","incredible season finale severance one best episodes television time congrats furious mark making choice right choice set season army severed employees lumon ready wage rebellion leadership helly can lead rebellion carrying legacy kier way jame wanted planned milchick captive rebellion frustrated lumon aligned rebellion will serve powerful role mediator two groups well stake stuck middle conflict gemma free meaning can work devon cobel contact police press try get lumon shut loves mark will want help innies achieve goal time meanwhile cobel care innies motivated revenge leading conflict outside group strategy irv town can turn local issue national issue expanding scope severance conflict drastically given town named kier many residents religiously loyal company local police likely compromised national politicians military needed will reghabi likely hope satisfying ultimate goal innies rebellion way can simultaneously agreeable outies chaotic unreliable hero anyone want wait show come back"
"2890","s2_1105","woman shares threw viral severance themed birthday party season finale neared face face africa"
"2891","s2_1106","still thinking severance season finale"
"2892","s2_1107","incredible season finale severance one best episodes television time congrats furious mark making choice right choice set season army severed employees lumon ready wage rebellion leadership helly can lead rebellion carrying legacy kier way jame wanted planned milchick captive rebellion frustrated lumon aligned rebellion will serve powerful role mediator two groups well stake stuck middle conflict gemma free meaning can work devon cobel contact police press try get lumon shut loves mark will want help innies achieve goal time meanwhile cobel care innies motivated revenge leading conflict outside group strategy irv town can turn local issue national issue expanding scope severance conflict drastically given town named kier many residents religiously loyal company local police likely compromised national politicians military needed will reghabi likely hope satisfying ultimate goal innies rebellion way can simultaneously outies chaotic unreliable hero anyone want wait show come back"
"2893","s2_1108","apparently person intensely dislikes severance ben stiller pulling another tropic thunder actually making parody pretentious sci fi melodrama season interpretation"
"2894","s2_1109","apple tv account replies will make one watch severance"
"2895","s2_1110","severance season finale ben stiller dan erickson interview"
"2896","s2_1111","severance season finale ends twist always going end way"
"2897","s2_1112","severance show ben stiller mind lemme get show"
"2898","s2_1113","ben stiller wtf finale absolute chaos severance season peak fiction"
"2899","s2_1114","looking back season thought bold choose reintegrate mark rd episode supposedly many others assumed episode long process guess planning ending severance"
"2900","s2_1115","expect severance season finale full homage michael jordan bulls era"
"2901","s2_1116","back half severance season funny cause everyone little lumon investigation whenever cut irving just heart ripped stomped every scene"
"2902","s2_1117","promise buy new phone every year new season severance comes"
"2903","s2_1118","season finale severance wow lot process"
"2904","s2_1119","reminding breathe tail season finale severance star spoke paper character role changed throughout two seasons putting spin choreography merriment"
"2905","s2_1120","everyone going torn severance star dichen lachman reacts popular apple tv show intense season finale event oneplus tecnologia gaming digital"
"2906","s2_1121","friday sun shining severance renewed season"
"2907","s2_1122","much appreciate cinematography show think done watching season just become absurd nonsense passing episode severance"
"2908","s2_1123","speaking severance season absolutely give us milchick backstory like main character know anything real just always clock"
"2909","s2_1124","praise kier apple global hit emmy peabody award winning workplace thriller severance lands season renewal severance severance season severance finale severanceseason"
"2910","s2_1125","severance show afraid ask lot stuff animatronics"
"2911","s2_1126","need severance season expeditiously"
"2912","s2_1127","severance fell season"
"2913","s2_1128","wrong severance instead show discussions show will super rad engagement bait formula gonna lie show terrific camera work color grading set design still dig easter eggs supposed main driver interest though"
"2914","s2_1129","severance undeniable hit apple now arrow arrow"
"2915","s2_1130","just movies movie people know mean way severance just another show people watch shows get get"
"2916","s2_1131","telling severance tv show just basically kingdom hearts get outta"
"2917","s2_1132","insane lead streaming services quality shows past years ted lasso black bird slow horses silo shrinking obviously biggest show country right now besides white lotus severance"
"2918","s2_1133","every clip see severance just black guy dancing basement show even"
"2919","s2_1134","saw article recently apple losing billion last year streaming really give severance silo biggest shows renewed episodes really hard manslightly smiling face left right arrow"
"2920","s2_1135","severance set design control coded season finale aw aw coded get sam lake episode"
"2921","s2_1136","severance season finale without context"
"2922","s2_1137","severance season finale suck nuts oh im gonna kill everything"
"2923","s2_1138","severance star britt lower breaks series season two finale mark shocking decision central question animating romantic final moments innies lives matter read interview"
"2924","s2_1139","severance creator ben stiller unpack finale next mark helly reintegration long season"
"2925","s2_1140","severance creator ben stiller unpack finale next mark helly reintegration long season"
"2926","s2_1141","season finale severance just pissed tf"
"2927","s2_1142","ingesting images transcript adam scott severance finale fans thirsting short hair telling wife spoilers description adam talks finale severance apple tv telling wife"
"2928","s2_1143","severance creator ben stiller unpack finale next mark helly reintegration long season"
"2929","s2_1144","fair weather severance fans pitched little fits conniptions delayed gratification inherent serialized medium will show contrition now deeply satisfying finale never lost faith rewarded praise kier"
"2930","s2_1145","severance dichen lachman shares reaction shocking season finale exclusive"
"2931","s2_1146","stayed watched late last night risk spoilers severance brunch show got watch night vibes"
"2932","s2_1147","day waiting season severance"
"2933","s2_1148","watching last episode season severance eyes fursuit friday"
"2934","s2_1149","virtual melon bar severance party popper melon watermelon"
"2935","s2_1150","season finale severance seismic shift psychological landscape"
"2936","s2_1151","mind bending choices explosive season finale severance severance season finale mark scout apple tv"
"2937","s2_1152","epic introduction lumon choreography merriment department severance season two finale convinced tramell tillman initially want dance season change mind"
"2938","s2_1153","glad good week got watch finale show like good thing severance got renewed season today smiling face smiling eyes"
"2939","s2_1154","season finale severance plot hole needs explained"
"2940","s2_1155","severance season finale context"
"2941","s2_1156","nice wind calm relaxing episode pitt severance season finale"
"2942","s2_1157","get topic business short exist"
"2943","s2_1158","yall know severance know much darker sinister place"
"2944","s2_1159","us petey stans rejoicing appearance season painting severance"
"2945","s2_1160","severance renewed season appears well lumon industries"
"2946","s2_1161","can wait see door related shenanigans dylan milchick get season severance severance finale"
"2947","s2_1162","genuinely great ending fun twisty season show ended super satisfied course glad getting severance soon"
"2948","s2_1163","severance got greatest season finales ever seen"
"2949","s2_1164","full episode breakdown tube channel now incredibly heartbreaking finale severance season"
"2950","s2_1165","getting apple whatever just watch severance"
"2951","s2_1166","severance finale interesting lol ended like stretch another season"
"2952","s2_1167","severance season finale brilliant btw highly recommend watching interviews face tears joy"
"2953","s2_1168","severance questions season finale"
"2954","s2_1169","will show real president even better man zelena trump severance sb mccelebrity ec"
"2955","s2_1170","jen tullock taken quite journey devon season severance appreciated opportunity unpack process crazy developments finale beware spoilers watch full conversation"
"2956","s2_1171","major questions severance season"
"2957","s2_1172","chances mean started season severance last night right finale lol thought season"
"2958","s2_1173","pls tell without apple tv watching severance"
"2959","s2_1174","now watching severance season finale"
"2960","s2_1175","severance season finale march madness copperhead course pga tour weather getting warm atlanta united plays college baseball conference play kirk cousins might traded type week write poems"
"2961","s2_1176","man shutup"
"2962","s2_1177","th one free episode got watch edge seat"
"2963","s2_1178","last night family waffle party severance season finale"
"2964","s2_1179","drop severance merch will fix"
"2965","s2_1180","ingesting images transcript severance season ending explained episode breakdown recap review description severance season episode breakdown ending explained depth recap review season"
"2966","s2_1181","yes will watching season severance"
"2967","s2_1182","going miss watch severance every thursday night season incredible"
"2968","s2_1183","severance star britt lower breaks series season two finale mark shocking decision central question animating romantic final moments innies lives matter read interview"
"2969","s2_1184","severance season finale"
"2970","s2_1185","even severance star tramell tillman knows milchick good bad theories"
"2971","s2_1186","stilling thinking severance season finale im sick"
"2972","s2_1187","company like apple sure losing right mental model spending part brand marketing add value service partners like cellular service providers"
"2973","s2_1188","man can wait break severance season finale fire raising kanan deliver imo patreongang"
"2974","s2_1189","just finished severance great ending season season hit kissed glad ended hit looking forward season"
"2975","s2_1190","okay least feel reasonably confident nobody else onebeaming face smiling eyes kier bless severance severance finale severance season severance spoilers milchick milkshake"
"2976","s2_1191","now great time rewatch westworld wait severance season bad available anywhere stream"
"2977","s2_1192","believable since reason marketing shows fantastic shows literally got hype train word mouth stumbling upon lol"
"2978","s2_1193","lot fun speculating substack severance story may go next jaw dropping season finale week click check npr review unhinged guesses future"
"2979","s2_1194","want buy copy hang next canvass boy apple grand budapest severance"
"2980","s2_1195","gotta one worst finales seen hope plan season severance"
"2981","s2_1196","funny severance season just kinda overlooked show streaming service one cared now half fandom basically posting takes sound like scene first season"
"2982","s2_1197","love show every character amazing well done well done last night season finally mind blowing severance ben stiller thinks stuff bouquet"
"2983","s2_1198","severance season finale photos team makes dangerous last stand cold harbor"
"2984","s2_1199","severance season"
"2985","s2_1200","love severance ted lasso perfect show pandemic jason sudeikis recently announced show will coming back season"
"2986","s2_1201","dawg even know going survive without severance life show compelling one"
"2987","s2_1202","opportunity lift fantasy drum major jackson state university hell yes tramell tillman"
"2988","s2_1203","character mark show severance"
"2989","s2_1204","art profitable even film television funded patrons wanted contribute common good apple tim cook amazon jeff bezos seem trying level regardless feelings severance rings power fact make profit exist might encouraging sign future creative storytelling driven focus groups"
"2990","s2_1205","official severance perfect"
"2991","s2_1206","severance actually good just big show propaganda"
"2992","s2_1207","wonder syria syrians will reintegrate even possible thank entire severance team making incredible show masterpiece severance"
"2993","s2_1208","breaking news mr milchick confirmed super bowl lx halftime show severance"
"2994","s2_1209","severance season finale im going kill"
"2995","s2_1210","stream tv series hollywood life backhand index pointing right entertainment severance tv hollywood life series stream"
"2996","s2_1211","season going open bunch dead marching band members severance"
"2997","s2_1212","apple aapl just renewed severance rd season"
"2998","s2_1213","caught severance peeps tramell tillman gwendoline christie dichen lachman unpack finale marching bands goats baby cribs windmills mind"
"2999","s2_1214","severance renewed season ben stiller thought series might get made"
"3000","s2_1215","breaking severance season finale ben stiller creator dan erickson know supposed feel"
"3001","s2_1216","severance season"
"3002","s2_1217","severance officially renewed season apple tv"
"3003","s2_1218","severance season finale right piss"
"3004","s2_1219","apple ceo tim cook responds ben stiller confirms severance will getting third season"
"3005","s2_1220","everyone going torn severance star dichen lachman reacts popular apple tv show intense season finale event yt"
"3006","s2_1221","stream tv series hollywood life backhand index pointing right entertainment severance tv hollywood life series stream"
"3007","s2_1222","years waiting severance fans finally understand meaning behind one mysterious aspects lumon industries"
"3008","s2_1223","anyone watch season finale severance last night mind blowing well done ben stiller show cast perfection 1st place medal bouquet"
"3009","s2_1224","think biggest problem second season severance lumon went sinister mysterious cartoonish top marching band totally place season"
"3010","s2_1225","shortly season finale apple tv announced severance will officially return season"
"3011","s2_1226","severance renewed third season anyone building even know"
"3012","s2_1227","police car light severance officially happening shocking finale left us questions answers gemma fate ms cobel true intentions big mysteries need next season unravel"
"3013","s2_1228","severance renewed season ben stiller thought series might get made"
"3014","s2_1229","britt lower dynamic mark helly gemma severance think really like love hexagon read spoiler discussion lower adam scott dichen lachman"
"3015","s2_1230","britt lower dynamic mark helly gemma severance think really like love hexagon read spoiler discussion lower adam scott dichen lachman"
"3016","s2_1231","severance renewed season ben stiller thought series might get made"
"3017","s2_1232","severance season finale good almost perfect kind wish end show gonna dumb try stretch another seasons many loose ends left"
"3018","s2_1233","severance renewed season ben stiller thought series might get made"
"3019","s2_1234","severance renewed season"
"3020","s2_1235","kinda hate season severance ended probably way season happen"
"3021","s2_1236","season ep got money mr milchick severance severance finale"
"3022","s2_1237","need severance season"
"3023","s2_1238","crazy ben stiller saw completely rewrote severance season"
"3024","s2_1239","severance fans needs pass basic human empathy test can comment season finale"
"3025","s2_1240","ima start season severance frfr"
"3026","s2_1241","season finale severance absolutely perfect hopefully will take another three years release next season amazing work crew"
"3027","s2_1242","wrong severance instead show discussions will super rad engagement bait formula gonna lie show terrific camera work color grading set design still dig easter eggs supposed driver interest though"
"3028","s2_1243","season severance strong season cringe scenes season best episode whole series woes hollow almost perfect season finale two big flaws aka lorne drummond otherwise solid show"
"3029","s2_1244","love show severance much makes think split lives displaced exiled part go home rest never many displaced syrians home real unreachable place exists memory dreams"
"3030","s2_1245","severance season"
"3031","s2_1246","adam needs move"
"3032","s2_1247","watched severance season finale last night pretty hammered now innie outie situation half knows happened half reintegrating remembers lot bright colors band"
"3033","s2_1248","severance renewed season ben stiller thought series might get made"
"3034","s2_1249","capping season coverage long recap beautiful absurd times frustrating severance finale"
"3035","s2_1250","severance stars explain season harrowing finale love hexagon"
"3036","s2_1251","severance renewed season"
"3037","s2_1252","severance saved season pretty good finale pitt mid season episode blew water great night tv"
"3038","s2_1253","basically new show decent enough watch now just severance white lotus can either talk shows skip contemporary tv together"
"3039","s2_1254","give tramell tilman show even care premise show watch seasons severance"
"3040","s2_1255","severance one well crafted seasons tv ever watched show iv tapped artistic part brain effortlessly weaving motifs deep cultural historical significance within visually stunning narrative everything hits masterpiece"
"3041","s2_1256","think season severance weaker first letdown means either think got great performances interesting story beats thoughts finale spoilers course"
"3042","s2_1257","severance stop end season perfect episode perfect show notes"
"3043","s2_1258","haven gobsmacked season finale since ozark season severance exploding head"
"3044","s2_1259","severance really might best tv show time"
"3045","s2_1260","severance fun wish hadn found show bc often times minimal questions answered episode season"
"3046","s2_1261","sorry hater think actually helena end severance finale think misunderstanding show"
"3047","s2_1262","headline severance renewed season wait aired last episode ending knowing severance getting third season"
"3048","s2_1263","severance season finale wrapped"
"3049","s2_1264","watch tv weekend march severance season finale wicked"
"3050","s2_1265","lemme wrap severance season"
"3051","s2_1266","severance renewed season apple tv orders woe frolic dread malice severance"
"3052","s2_1267","severance type show going call shotslop tumblr film gifs edited together minutes"
"3053","s2_1268","severance season"
"3054","s2_1269","severance star dichen lachman breaks gemma mark heavy season finale reunion just kept crying"
"3055","s2_1270","severance best show rn season better take"
"3056","s2_1271","tv series severance season created ben stiller flawed season sure major highlights especially loved finale think show needs continue focusing characters less mystery"
"3057","s2_1272","oh rumors true lmaoo"
"3058","s2_1273","long severance see soon homage help ai season best scene"
"3059","s2_1274","separating parent auto policy scary help good neighbor contact anytime help sorting policies severance season now streaming link"
"3060","s2_1275","yeah"
"3061","s2_1276","breaking old shirt honor last episide severance brilliantly lynchian show seen since"
"3062","s2_1277","severance amazing fav show platform"
"3063","s2_1278","severance season finale proves good tv coming back"
"3064","s2_1279","can wait season severance"
"3065","s2_1280","sure take just yet comic ever followed like vincent onofrio kingpin tv series given thought least let know issue severance"
"3066","s2_1281","severance show looks quality might give eyes ears soon"
"3067","s2_1282","severance top tier season confirmed well"
"3068","s2_1283","severance season finale review shocked series best episode ended game changing cliffhanger decision mark"
"3069","s2_1284","truly group severance fans dedicated watching show soley office romantic thriller series innies viewer knows bigger scope situation nuance surrounding interesting"
"3070","s2_1285","waiting new season severance end can get week free trial binge cancel like real american outlying islands"
"3071","s2_1286","watch severance"
"3072","s2_1287","watch severance"
"3073","s2_1288","second season shocking conclusion left fans scrambling process emotional whiplash"
"3074","s2_1289","spoilers severance star jen tullock talk season finale tune stream via ktla app mobile phone arrow ktla laptop computer"
"3075","s2_1290","company currently work made marching band uniforms season finale severance happy excited see uniforms great show beaming face smiling eyes"
"3076","s2_1291","severance season finale best thing ever watched television history genius wait season"
"3077","s2_1292","think helly check recap two world feel works better way equator stuff hits finding little sanctuary within lumon helena literally owns place"
"3078","s2_1293","glad can alive one hottest love triangles st century"
