"","id","comments"
"4051","s2_2266","severance might greatest show ever made even joking"
"4052","s2_2267","streaming"
"4053","s2_2268","adam scott ben stiller unpack twisty severance season finale spoilers"
"4054","s2_2269","havent seen invincible past season severance yellowjackets white lotus watching daredevil tho"
"4055","s2_2270","just finished severance season finale wow ride twists emotional depth reeling huge kudos cast crew delivering compelling storytelling can wait see season takes us severance season finale apple tvplus mind blown tvthriller must watch binge worthy sci fi drama cliffhanger tvaddict"
"4056","s2_2271","season severance finale one greatest pieces television ever seen team work forever inspired thank"
"4057","s2_2272","glad decided watch severance finale tonight one image adam scott episode pretty sure will plastered everywhere noon tomorrow anyways great finale hope wait season shorter"
"4058","s2_2273","season finale severance legit masterpiece loved yet absolutely hate"
"4059","s2_2274","wow just wow severance"
"4060","s2_2275","severance season finale sheesh man"
"4061","s2_2276","severance best show ever asf"
"4062","s2_2277","severance pretty good show think"
"4063","s2_2278","mr milchick giving severance halftime show life mark helly"
"4064","s2_2279","severance season two finale brought every emotion inside nervous angry laughing crying dancing show please announce season release date"
"4065","s2_2280","since rewatched severance first season now wrapped season two can now reaffirm severance bad"
"4066","s2_2281","brain will look like severance season comes severance"
"4067","s2_2282","severance season finale pissed right tf running gonna start new life cubical somewhere like just shoot one main bosses neck think just gonna go back putting numbers files btw helena brother"
"4068","s2_2283","nightcap severance season finale"
"4069","s2_2284","deeply perturbed severance season finale free girl gemma"
"4070","s2_2285","severance season finale actually gif farming"
"4071","s2_2286","ok people just spoiling severance left right guess honestly end series fine shining tv movie crown horror laughs chills transformative stuff"
"4072","s2_2287","can someone find right numbers temper anger season finale pouting face severance"
"4073","s2_2288","pitt best tv show right now even debatable also haven seen severance"
"4074","s2_2289","remembering seeing somewhere crew idea anyone care show filming first season hope guys can always continue see just wonderful impactful severance love show deeply"
"4075","s2_2290","completed watching severance season give generational show instant classic timeless masterpiece wish watched finale theaters eagerly anticipating third season"
"4076","s2_2291","gonna get season right severance"
"4077","s2_2292","genuine reaction watching final episode severance season"
"4078","s2_2293","yep billion year worth severance just dropped one best episodes time need season green lighted now"
"4079","s2_2294","never watched moment severance got marching band now favorite show rolling floor laughing"
"4080","s2_2295","think convince apple physical release severance know got dvd blu ray"
"4081","s2_2296","guess finishing severance maybe years can watch season together"
"4082","s2_2297","severance can take long want season victory hand"
"4083","s2_2298","also severance season finale might best finale series ever still chills"
"4084","s2_2299","severance amazing show pissed rn wth"
"4085","s2_2300","guess severance finale end way season"
"4086","s2_2301","hopefully ricken severance season"
"4087","s2_2302","finished severance think next season will just let go episodes watching cliffhangers much"
"4088","s2_2303","best experience ever watching show ever incredible finale severance"
"4089","s2_2304","severance season finale"
"4090","s2_2305","brain watching season finale severance"
"4091","s2_2306","season finale severance amazing will replaying last scene head weeks"
"4092","s2_2307","review new severance severence season finale well doozy guys kind crazy episode left scratching head suspensed edge seat severance let know guys thought severance fans pretty stoked amazed severence"
"4093","s2_2308","season finale severance best episode television ever seen"
"4094","s2_2309","fomo real think will awake severance ko season finale sakida saama sprint qualifying ko time huncha"
"4095","s2_2310","liked severance can help feel mark reintegration wasted opportunity felt like bold move early kinda like show ended feel preferred see show actually"
"4096","s2_2311","finally caught severance season amazing besides episode severance"
"4097","s2_2312","need season three severance perfect"
"4098","s2_2313","supposed normal severance season finale"
"4099","s2_2314","rewarding watching gut wrenching episode television history severance season finale watching bunch teenage girls cannibalize soccer coach wind"
"4100","s2_2315","just finished season severance truly amazing tv legend"
"4101","s2_2316","caught severance frustrated annoyed can tell greatest show ever biggest waste time"
"4102","s2_2317","severance really nailed landing finale show even remotely better paradise pitt anything can wait season"
"4103","s2_2318","finished severance season kind funny course ends way hell season"
"4104","s2_2319","severance season finale"
"4105","s2_2320","thank apart masterpiece severance greatest show time"
"4106","s2_2321","show clapping hands severance"
"4107","s2_2322","severance season finale gets two thumbs thumbs thumbs"
"4108","s2_2323","think way apple fine especially severance big now essentially advertising keeping relevant multiple fronts like actors advertise apple tv pet projects apple seems like finance bad bill"
"4109","s2_2324","yall season finale severance wild absolutely wild"
"4110","s2_2325","finally watched severance season finale much already time show territory lot without lot can wait whats next just elite performance top elite performance season goodness"
"4111","s2_2326","just finished watching season finale severance one talk"
"4112","s2_2327","severance built entire season television based image"
"4113","s2_2328","anyone else get besides graduate logan run blows vibes last shot severance season finale regardless beautiful tribute classic cinema"
"4114","s2_2329","amount people outing understanding entire point season severance tonight dumbfounding mark justified tracks every theme plotline season people even watch show first scene ep"
"4115","s2_2330","next season severance mr milchick finds mr drummond fact devour feculance severance"
"4116","s2_2331","best show history yes biased yo wtf severance"
"4117","s2_2332","severance best tv show since game thrones generational"
"4118","s2_2333","ending minutes severance season possibly romantic thing history tv"
"4119","s2_2334","ben stiller hints severance season wait will long ben stiller severance severance season tvshows streaming entertainment news must watch binge worthy upcoming season fan theory hotnews news breaking entertainment movie"
"4120","s2_2335","severance season finale"
"4121","s2_2336","let smoke hookah watch new episode severance apple tv"
"4122","s2_2337","next season severance mr milchick finds mr drummond fact devour feculance"
"4123","s2_2338","season finale severance just pissed"
"4124","s2_2339","season finale severance"
"4125","s2_2340","absolute banger season finale severance"
"4126","s2_2341","im genuinely still mad abt severance like apple tv make us wait three years will take years swear"
"4127","s2_2342","severance went exactly wanted perfect season ending"
"4128","s2_2343","think havent excited season finally since lost fringe zany face smiling face sunglasses grinning face sweat severance"
"4129","s2_2344","please listen sponsor guest podcast tolak ruutni severance jhope zelenskyy pekin express zeuchi ซอง แดง แต่ง ผี"
"4130","s2_2345","honestly wtf place end better give us another season severance know alone many questions"
"4131","s2_2346","go way severance took show whole new frightening level know next will seated without doubt incredible way cap season really stick landing"
"4132","s2_2347","outie depressed watching season finale severance"
"4133","s2_2348","severance best tv show last decade maybe time depending whether next seasons keep quality"
"4134","s2_2349","can wait mark get helly integrate show becomes sitcoms healthy throuple ever uncle irv cousin dylan devin hopefully divorces ricken severance"
"4135","s2_2350","watched every episode severance intense intent lights phone distractions just fully engaged show characters intricacies best experience concluding tonight masterful finale show season"
"4136","s2_2351","severance already top time season finales clapping hands dark skin tone clapping hands dark skin tone"
"4137","s2_2352","severance season finale absolute banger"
"4138","s2_2353","shook severance season finale exploding head"
"4139","s2_2354","absolutely crushed season finale severance"
"4140","s2_2355","severance finale ending just pissed bad now gotta go sleep mad af gotta wait two years season"
"4141","s2_2356","will mind get season episode just oh sad disappointing severance finale severance"
"4142","s2_2357","speechless like jaw floor last minutes finale god need season asap severance"
"4143","s2_2358","friday got severance season finale recap spoiler filled interview creator dan erickson big big severance news meet equator"
"4144","s2_2359","oh man severance season finale started banger cam corder convo let whole way clapping hands never happy character mad part minutes later lol plan just another torture scenario loudly crying face"
"4145","s2_2360","just saying mid shows still amazing silo good one partial badass action scenes see though got watching apple shows severance kept around black bird one best anything ever watched"
"4146","s2_2361","severance"
"4147","s2_2362","severance season finale crash fear dizzy face dizzy"
"4148","s2_2363","thought severance season finale great loved"
"4149","s2_2364","just finished severance finale wait season begins"
"4150","s2_2365","first line severance season episode finale ending song go hannah go helena eagan calls gemma hannah meets mark chinese restaurant just interesting detail just noticed eyes severance"
"4151","s2_2366","severance"
"4152","s2_2367","severance season finale peak"
"4153","s2_2368","contract absolutely get loose per season severance"
"4154","s2_2369","scrolling tl pretending see severance season finale spoilers"
"4155","s2_2370","can make new phone every year severance"
"4156","s2_2371","stay tuned season severance"
"4157","s2_2372","waiting severance season three see gemma thinks mark actually moved daughter"
"4158","s2_2373","severance one best season finales time mammalians nurturable goat"
"4159","s2_2374","ben stiller hints severance season wait will long ben stiller severance severance season tvshows streaming entertainment news must watch binge worthy upcoming season fan theory"
"4160","s2_2375","severance ended season like way twilight zone episodes end decided continue bittersweet ending satisfying done well still many questions left unanswered"
"4161","s2_2376","face watched season finale severance"
"4162","s2_2377","add part severance finale live show"
"4163","s2_2378","haven felt something show long time severance just amazing"
"4164","s2_2379","please spoil want know season finale severance trying blab one person might something sci fi nights ruiined glowing star buck"
"4165","s2_2380","re watching seasons finale severance apple tv dexter fromily"
"4166","s2_2381","thought severance season"
"4167","s2_2382","severance discourse sucks two sides just refusing engage complexity show inviting us think"
"4168","s2_2383","severance finale best episode season two maybe series far"
"4169","s2_2384","severance season finale fire"
"4170","s2_2385","think like ending severance season need think cuz think ending set still"
"4171","s2_2386","will never move severance phase im sorry show just means way much"
"4172","s2_2387","huge fomo ppl watching severance apple tv bc apple tv anymore want get subscription pensive face"
"4173","s2_2388","severance really stuck landing genius finale tremendous season television many remarkable people praise"
"4174","s2_2389","incredible last scene soul crushing amazing show severance"
"4175","s2_2390","innie mark killin thank great nd season severance"
"4176","s2_2391","love route severance finale markhelly took listened wanted perhaps first time first season children innocent curious obedient now lot fight"
"4177","s2_2392","ricken painting gonna need standalone ep season severance"
"4178","s2_2393","ready years people sprouting severance theories based individual lines obscure background details will long wait season"
"4179","s2_2394","severance season finale fuck"
"4180","s2_2395","severance broke tonight gut punch gut punches hats everyone show"
"4181","s2_2396","ben stiller dan erickson better start filming season severance right now"
"4182","s2_2397","zach cherry monster actor season severance give emmy nomination"
"4183","s2_2398","another weird shot zoom shot film show can use certain gag shot audience can understand fit cinematography like either maybe another way can think multiple directors represent kind severance breaking th wall"
"4184","s2_2399","ok ok ok like severance edits much better love guys editors reason like show now loudly crying face rolling floor laughing"
"4185","s2_2400","season finale severance"
"4186","s2_2401","started severance week ago start slow gets better better goes started season yesterday wow already improvement already great first season can wait get finale severance"
"4187","s2_2402","need season three now severance"
"4188","s2_2403","gonna bummed wait another years severance oh god show otoh dope thief also really good apple tv putting quality stuff"
"4189","s2_2404","severance things show ever incredible sequence"
"4190","s2_2405","can just get severance season now"
"4191","s2_2406","yeah severance finale erased problems season"
"4192","s2_2407","severance license song end credits next season"
"4193","s2_2408","finale severance best tv show right now"
"4194","s2_2409","just finishing finale"
"4195","s2_2410","end credits severance season finale incredible standalone art piece great finish sophomore season"
"4196","s2_2411","completely mentally unstable severance season finale loudly crying face goat"
"4197","s2_2412","back forth severance finale mark outtie absolutely nuts change camera handicam actual show camera razy"
"4198","s2_2413","severance season finale loudly crying face"
"4199","s2_2414","severance season finale emotional roller coaster loudly crying face loudly crying face good"
"4200","s2_2415","severance season finale better nuts"
"4201","s2_2416","severance season two finale"
"4202","s2_2417","shoutout entire severance cast production writers everyone involved show perfect ending another amazing season"
"4203","s2_2418","severance season finale review just like fr"
"4204","s2_2419","supposed go sleep watching severance season finale bro"
"4205","s2_2420","severance season finale"
"4206","s2_2421","frustrating season finale severance mark dumbass severence"
"4207","s2_2422","think ideal silo foundation equally good opinion haven crossed mainstream interest well severance apple may push drive subs apple sadly pensive face"
"4208","s2_2423","gemma story impossibly tragic wish whole heart hadn ended far way mean imark love helly less valid beautiful devastating think ppl missing point whole show severance"
"4209","s2_2424","cats show us love transcends forms reminding us universal language affection rainbow severance cats cat catlovers"
"4210","s2_2425","severance season finale"
"4211","s2_2426","severance season finale screaming tv"
"4212","s2_2427","omfg severance season finale good"
"4213","s2_2428","severancespoilers severance invested tv show long time milchick undoubtedly one favorite characters easy dislike punching easy love punching dancing running almost anything else"
"4214","s2_2429","reading far severance favorite way relax show lights imagination much age loving relieved face"
"4215","s2_2430","severance season blows unwatchable"
"4216","s2_2431","severance end season perfectly dark complete"
"4217","s2_2432","going long wait till severance season"
"4218","s2_2433","severance spoilers pls just started season"
"4219","s2_2434","just everyone can sleep severance season finale"
"4220","s2_2435","ending severance season still jaw dropped can wait season loudly crying face severance"
"4221","s2_2436","severance best show ever watched"
"4222","s2_2437","let adam scott hot severance season finale"
"4223","s2_2438","severance apple tv rundown severance season finale spoilers technically"
"4224","s2_2439","severance season finale march madness"
"4225","s2_2440","statistics test just whooped feet really getting nervous like omfg season finale severance everything need"
"4226","s2_2441","think liked severance finale part ugh feel like lot issues skirting aside season came fruition episode bleh know fun will happily watch comes next consider bit weary"
"4227","s2_2442","severance season finale epitome love movies tv thanks rest incredible cast crew amazing show can wait"
"4228","s2_2443","severance season"
"4229","s2_2444","severance finale fantastic really hoping leave us questions answers definitely delivered strong second season"
"4230","s2_2445","severance season two ends helena eagan using glasglow block trick mark side smile britt lower expertly performs confirms outie tell mark got played hard least twist end gives season something work happy"
"4231","s2_2446","severance amazing show season can come soon enough"
"4232","s2_2447","showing picture someone saw season severance"
"4233","s2_2448","episode broken ways show able can let gemma happy bro loudly crying face severance"
"4234","s2_2449","everything society learned making television season episode severance made never life seen something rocked like episode oh god"
"4235","s2_2450","wow just wow pin needles start finish season finale severance"
"4236","s2_2451","severance best show seen recent memory severance"
"4237","s2_2452","severance maybe best show time ian cappin either"
"4238","s2_2453","severance top show time bap"
"4239","s2_2454","finale laughed shed tears cheered loudly characters taking stands curious go love cast minds attached series much ready shows return never forget helly never cruel severance"
"4240","s2_2455","season severance distraught"
"4241","s2_2456","watching severance omg"
"4242","s2_2457","severance season ending even better philips hue tv lighting gotten free via amex biz plat"
"4243","s2_2458","even know feel season finale severance head swimming"
"4244","s2_2459","severance season finale context severance appletv"
"4245","s2_2460","need season severance reasonable time please thank"
"4246","s2_2461","severance season finale flawless notes"
"4247","s2_2462","severance season just top notch television people thought slow season think liked first maybe last episode good even worth whole season hope next season comes quicker"
"4248","s2_2463","severance best show time absolute perfection"
"4249","s2_2464","right sad frustrating times first thing comes mind series counterpart spy scifi series jk simmons truly believe severance got inspiration show duality parallel worlds character doubles"
"4250","s2_2465","just watched severance season finale since ppl haven seen yet will just say wild"
"4251","s2_2466","can believe just witnessed severance need season tomorrow bruh got sum explaining sir"
"4252","s2_2467","severance one greatest needle drops season finale"
"4253","s2_2468","jaw dropping severance season finale leaves fans speechless ben stiller war criminal"
"4254","s2_2469","mark really woke covered blood even question cause wife back severance show lovers fr"
"4255","s2_2470","just watched season finale severance"
"4256","s2_2471","know ppl watched severance besides youtubers lol good hope season years apart great episode"
"4257","s2_2472","tonight finale can confirm severance greatest show time"
"4258","s2_2473","severance best tv show years gotta best since breaking bad ended"
"4259","s2_2474","lie end severance ok ending get wrong will watch another season yeah itch scratched"
"4260","s2_2475","official petition mr milchick marching band super bowl lx halftime show severance"
"4261","s2_2476","just finished severance season two finale zoinks trip scoob"
"4262","s2_2477","mark gemma severance season finale"
"4263","s2_2478","yeah official severance favorite show time top tier thriller television firing cylinders will find better shot better acted better written show severance"
"4264","s2_2479","think lot security guard important person history jus one guy dies season severance"
"4265","s2_2480","unreal maybe greatest season finale ever seen probs recency bias good lord severance team killed"
"4266","s2_2481","ok going say severance best series right now simply incredible"
"4267","s2_2482","think series finale severance feels pretty final"
"4268","s2_2483","matter many seasons get every season finale include milchick trying get door solid minutes severance"
"4269","s2_2484","severance season finale absolutely delivered hats cast crew creators show severance"
"4270","s2_2485","matrix series favorite love story time let finally marathon severance"
"4271","s2_2486","one weirdest season finales can remember lmao severance"
"4272","s2_2487","dear absolutely incredible work art just happened severance entire cast crew needs high praise cinematic work art chip flooded mark still switching back forth innie outie severance"
"4273","s2_2488","hey release severance merch problem solved"
"4274","s2_2489","severance perfectly written acted executed show can think another thing let alone show feels complete well thought yet unpredictable viewer astonishing"
"4275","s2_2490","alright severance season finale time see side"
"4276","s2_2491","nah just ran storylines lots apple shows great bad monkey silo severance slow horses losing money probably big budget movie stuff like gorge"
"4277","s2_2492","severance season finale teea"
"4278","s2_2493","will never enough season finales brienne tarth taking mountain matter series severance"
"4279","s2_2494","severance gets better better every episode truly great finale cant wait watch whole season come"
"4280","s2_2495","watch severance season finale"
"4281","s2_2496","severance season finale good"
"4282","s2_2497","completely forgot severance finale tonight shows little season moved guess"
"4283","s2_2498","go watch season finale severance come back us losing bulls opportunity loudly crying face"
"4284","s2_2499","severance finally got gangsta season finale"
"4285","s2_2500","starting finale severance just realized reminds another show society tomorrow corporate reasons face tears joy"
"4286","s2_2501","exactly supposed tell boss can concentrate severance finale distracted work tomorrow oh well guess innie problem"
"4287","s2_2502","season asap severance"
"4288","s2_2503","dare say severance game thrones level idk haven felt way tv show long time weary face dontyellatme"
"4289","s2_2504","severance season finale face raised eyebrow"
"4290","s2_2505","season finale severance time ah"
"4291","s2_2506","show cooked mentally like severance bless"
"4292","s2_2507","severance season finale somebody give gun"
"4293","s2_2508","quite like tarantino esq severance season finale wth ended better need season"
"4294","s2_2509","adam scott ben stiller unpack twisty severance season finale spoilers"
"4295","s2_2510","whew baby knew finale split shippers also seeing people miss point outies want will fight autonomy show explores ramifications severance"
"4296","s2_2511","staring severance season finale see hour long loudly crying face"
"4297","s2_2512","plz plz begging get next season soon can ned severance"
"4298","s2_2513","severance season beyond mid"
"4299","s2_2514","official severance best show tv hands two absolute banger seasons"
"4300","s2_2515","fantastic episode television incredible season severance rules freaking hard"
"4301","s2_2516","like severance season finale"
"4302","s2_2517","slowly watching severance last weeks watch finale live thing saul lol oh god really really mind blowing journey happy another fan show dying waiting next episode"
"4303","s2_2518","severance season finale"
"4304","s2_2519","good thing glasses wine severance season finale"
"4305","s2_2520","severance really show"
"4306","s2_2521","severance finale good fine just ending show"
"4307","s2_2522","going start saying finale one best episodes television ever made takes three years make next season severance will hunt"
"4308","s2_2523","people feeling season severance knew cooking finale delivered"
"4309","s2_2524","also show proving point men rather block difficult emotions like grief start someone new go therapy severance"
"4310","s2_2525","going need season severance asap please make wait another years loudly crying face severance"
"4311","s2_2526","man severance good honestly think might best series lifetime"
"4312","s2_2527","severance greatest context show will ever see even context will understand"
"4313","s2_2528","watch severance appreciate ben stiller gets engages fans reminds old twitter people actually normal creators felt comfortable talking fans new episode show premiered miss days"
"4314","s2_2529","masterpiece season season thank severance"
"4315","s2_2530","need season rn severance"
"4316","s2_2531","think watching severance season finale anxiety attacks"
"4317","s2_2532","well annoying severance season finale"
"4318","s2_2533","severance man banger show can wait season"
"4319","s2_2534","everytime woman tortured show media whatever automatically main priority hope pray gets happy ending season gemma scout better get actual scenes dialogue severance"
