"","id","comments"
"1591","s1_1591","everyone please go watch severance can another season severance great thanks"
"1592","s1_1592","severance finale recap office"
"1593","s1_1593","creator dan erickson teased come esquire"
"1594","s1_1594","end knowing wait long time next season severance"
"1595","s1_1595","figured ben stiller crazy severance season ending"
"1596","s1_1596","talk cliffhanger severance new favorite show"
"1597","s1_1597","severance finale rarely tv get better definitely watching show"
"1598","s1_1598","wow finale especially final moments severance gave chills can wait season john turturro spectacular great limited screen time one"
"1599","s1_1599","going second season need watch finale severance"
"1600","s1_1600","season finale streaming now severance run walk"
"1601","s1_1601","season better deliver turturro walken kiss scene close severance"
"1602","s1_1602","time severance season finale"
"1603","s1_1603","sweet jesus severance good show twists turns need season like right now severance"
"1604","s1_1604","literally just yelled frustration ending severance want wait new season loudly crying face"
"1605","s1_1605","season severance better come another mde defiantjazz"
"1606","s1_1606","hey get work severance season asap please show become radar gem need"
"1607","s1_1607","watch podcast severance answers questions raises new ones season finale plus netflix elite back killing eve blows kiss goodbye"
"1608","s1_1608","severance apple tv genius genius"
"1609","s1_1609","severance season finale goes bang apple tv recap scout tafoya cult mac"
"1610","s1_1610","yo severance wtf finale just made mad needed see everything played need season asap"
"1611","s1_1611","severance season finale astonishingly good just incredible hour television stifle yelps tension throughout thanks everyone involved particular shouts creating perfect menacing soothing score"
"1612","s1_1612","severance apple tv fantastic honestly"
"1613","s1_1613","just finished severance finale holy cow ending season show can wait second season"
"1614","s1_1614","great show snart intriguing unpredictable amazing direction performances loved season finale can wait second season clapping hands clapping hands severance"
"1615","s1_1615","severance season finale probably best finale ever seen"
"1616","s1_1616","dream last night watching severance finale now im itching put brilliant show"
"1617","s1_1617","severance first season wonderfully tense workplace horror story"
"1618","s1_1618","rest holy cow set alarm early watch severance work wowza better cliffhanger shot jr thank amazing show now innie wish luck victory hand medium skin tone red heart smiling face smiling eyes"
"1619","s1_1619","severance far favorite show year waffle party messed can wait see coffee cozies congrats severance team amazing season severance"
"1620","s1_1620","severance season finale epic clapping hands clapping hands can wait till season two"
"1621","s1_1621","season finale severance available streaming today rate show"
"1622","s1_1622","haven worked office office setting many many years severance show pretty much nail things come"
"1623","s1_1623","waiting season severance severancefinale"
"1624","s1_1624","man gonna tough find better tv show severance year excellent first season"
"1625","s1_1625","first run back since marathon last sunday felt good good enough take dogs actual run today nice slow plus got watch season finale severance makes friday dreadmill much better"
"1626","s1_1626","severance season finale goes bang apple tv recap via"
"1627","s1_1627","severance season finale today aside wrapping one thematically visually ambitious seasons television time rewarding hour building tensions big reveals can wait season"
"1628","s1_1628","severance first season wonderfully tense workplace horror story news technology trends future innovation technews"
"1629","s1_1629","top greatest seasons television ever incredible finale episode severance sad wait season"
"1630","s1_1630","need season severance finale cliffhanger crazy"
"1631","s1_1631","severance season finale recap innies finally get explore real world writes"
"1632","s1_1632","severance season finale director ep ben stiller creator dan erickson cliffhanger ending revelations lumon alpha plan season status stiller film bag man"
"1633","s1_1633","severance season finale fire fire"
"1634","s1_1634","severance first season coming end know ton expect season already"
"1635","s1_1635","can crane skull severance green heart thank much show blue heart"
"1636","s1_1636","season finale severance whoa"
"1637","s1_1637","still trying decide feel severance finale heart pounding tense lot humor"
"1638","s1_1638","severance best show tv way go everyone else involved amazing show knocked first season park"
"1639","s1_1639","severance star britt lower learned helly big finale twist"
"1640","s1_1640","severance season finale goes bang apple tv recap scout tafoya"
"1641","s1_1641","severance finale might one time great tv season finales master director chair performances tension builds throughout just episode whole season put list shows watch asap"
"1642","s1_1642","shows like severance end season many unanswered questions really irritate tf"
"1643","s1_1643","read recap severance explosive season finale"
"1644","s1_1644","think severance season finale check depth interview cinematographer learn severed elevator transition shot right arrow"
"1645","s1_1645","watch severance apple tv hit one"
"1646","s1_1646","severance best first season television history"
"1647","s1_1647","severance excellent can wait next season"
"1648","s1_1648","loved severance worth watching sound like broken recird score mesmerizing something hear immediately think show first score since game thrones ostinado"
"1649","s1_1649","severance awesome absolutely great show"
"1650","s1_1650","severance first season wonderfully tense workplace horror story via"
"1651","s1_1651","can somebody else watch severance apple tv know trippin wild show"
"1652","s1_1652","severance first season wonderfully tense workplace horror story"
"1653","s1_1653","ted lasso great apple tv really something severance"
"1654","s1_1654","first season severance wonderfully exciting horror story workplace"
"1655","s1_1655","ok severance season finale quote mother cats pajamas highly recommend"
"1656","s1_1656","severance first season wonderfully tense workplace horror story"
"1657","s1_1657","severance first season wonderfully tense workplace horror story"
"1658","s1_1658","omg season finale severance intense know blood pressure roof entire time dillon straight soldier loved now gotta wait new season uggh"
"1659","s1_1659","severance season finale good haven watched episode show good bad news reading season will next year means finally arrives will like wait happened thinking face hate"
"1660","s1_1660","severance absolute masterpiece hands best show seen year can wait season"
"1661","s1_1661","haven loved show much since lost severance can stop thinking season finale going sever season will long year innie thanks amazing cast shot pandemic"
"1662","s1_1662","love severance upset season also haven heard second one"
"1663","s1_1663","omg severance finale exceptional raising hands medium light skin tone clapping hands medium light skin tone clapping hands medium light skin tone can wait season"
"1664","s1_1664","well say apple severance best list great recap"
"1665","s1_1665","severance yellowjackets mystery week shows feel different entire show hook single weird mystery think least try answer end season westworld good job went rails"
"1666","s1_1666","happy severance season finale day"
"1667","s1_1667","season finale severance good watched morning coffee stayed edge seat now jacked"
"1668","s1_1668","watching season finale severance early morning may best call totally freaked harmony"
"1669","s1_1669","severance season finale"
"1670","s1_1670","severance good wait next season already long"
"1671","s1_1671","severance finale one tensest exciting hours tv seen years spoke made way whole great season"
"1672","s1_1672","wow severance finale intense easily favorite apple tv show like westworld black mirror baby"
"1673","s1_1673","figured ben stiller crazy severance season ending tv tvfeatures"
"1674","s1_1674","vulture ny tyle severance season finale recap tale innies innies finally get explore real world severance explosive season finale"
"1675","s1_1675","severance director ben stiller talks wild finale casting show building characters can expect season two"
"1676","s1_1676","season finale gave us atleast one episode severance"
"1677","s1_1677","lindsay made horrible mistake watched episode severance town tuesday season finale tonight will accept thoughts prayers navigate troubled times"
"1678","s1_1678","black lady sketch show returns severance finale mlb apple tv via"
"1679","s1_1679","looking good new tv show get watch severance appletv fantastic episode gets better previous one hooked"
"1680","s1_1680","also severance fans whole devon found baby found eleanor found level cringe explaining metaphor dodgeball just brilliant expertlevelcringe bravo clapping hands medium light skin tone just renew forever"
"1681","s1_1681","wow severance finale disappoint best season television since early days lost going need support group get season"
"1682","s1_1682","holy severance nothing else say except say go watch show now"
"1683","s1_1683","finale par breaking bad better call saul freaking show severance amazing"
"1684","s1_1684","finale severance just best episode season also one best hours television recent memory recommend enough"
"1685","s1_1685","oh god severance finale ever going survive wait season"
"1686","s1_1686","now seen season finale severance official best television watching experience since breaking bad incredible show going need time recover"
"1687","s1_1687","way respects predicted twist entire dexter season built ten minutes season severance wild though predict one helly thing revealed finale really early season dying season two"
"1688","s1_1688","watch favor watch best show year tweet severance"
"1689","s1_1689","needs drugs got severance recap maddeningly perfect season finale"
"1690","s1_1690","severance wow season finale"
"1691","s1_1691","woke first thing turn watch season finale severance amazing show can wait season start"
"1692","s1_1692","severance astounding first season television knocked park"
"1693","s1_1693","apple tv going simply talk enough severance"
"1694","s1_1694","watch friday ablack lady sketch show elite icarly woke return central park ptolemy grey severance undercover boss finales friday night baseball apple tv"
"1695","s1_1695","okay just watched wtf supposed live season can severance"
"1696","s1_1696","good severance amazing show"
"1697","s1_1697","apple tv renews severance one series year disturbing series available platform starring adam scott patricia arquette dichen lachman john turturro christopher walken"
"1698","s1_1698","severance episode renewed season"
"1699","s1_1699","april just finished season finale greatest television ever seen gonna need minute severance"
"1700","s1_1700","severance season finale preview mark irving helly awaken"
"1701","s1_1701","severance star britt lower unpacks illuminating season one finale"
"1702","s1_1702","severance completed season give highest recommendation"
"1703","s1_1703","severance season finale recap tale innies"
"1704","s1_1704","watch severance literally obsessed"
"1705","s1_1705","severance moon knight show"
"1706","s1_1706","thank great work severance recaps helped enjoy show even"
"1707","s1_1707","severance top shelf viewing start finish"
"1708","s1_1708","just watched episode severance tvtime"
"1709","s1_1709","need new season severance like now"
"1710","s1_1710","finale watch season everyone else severance"
"1711","s1_1711","severance ending explained biggest wtf burning questions season finale"
"1712","s1_1712","wow incredible first season looking forward season severance"
"1713","s1_1713","severance one best pieces television ever created bravo stunning work imagination itching season"
"1714","s1_1714","gonna different next season severance smirking face"
"1715","s1_1715","just watched episode severance tvtime"
"1716","s1_1716","season finale intense need season right now smh severance"
"1717","s1_1717","severance finale one tensest bits telly can remember brilliant show every way"
"1718","s1_1718","severance apple tv literally best show seen cliffhanger"
"1719","s1_1719","season finale severance good"
"1720","s1_1720","ok watched first severance series people walking endless white halls"
"1721","s1_1721","severance literally dreamed season teasers brain wants"
"1722","s1_1722","wow severance finale phenomenal everyone involved show deserves massive praise last time gripped captivated dark netflix"
"1723","s1_1723","yo killer way end season god supposed wait year next episode severance"
"1724","s1_1724","season finale severance deserves awards"
"1725","s1_1725","severance hype yas new good sci fi show pog"
"1726","s1_1726","nah good job severance loving watch season finale glad got picked fir season congratulations"
"1727","s1_1727","pls watch severance apple tv haven already will regret"
"1728","s1_1728","unsatisfying end severance season ends just getting good doubt ensure get funded season just"
"1729","s1_1729","looking tv show suggest severance finale tonight blew away"
"1730","s1_1730","finale severance shookface open mouth face open mouth exploding head season pls come quickly watch show people"
"1731","s1_1731","watching season finale feel need retweet seriously stop watch severance"
"1732","s1_1732","severance season open discussion poll updated th april"
"1733","s1_1733","season start severance"
"1734","s1_1734","severance finale incredible tension music loved much severance severancefinale will wait year next season ah"
"1735","s1_1735","omfg need season like yesterday just got heated much mark says wife alive casey helly started tell miserable lumon irving banging burt door severance"
"1736","s1_1736","know one pause button tv dalton found newspaper face monocle read whole articlerolling floor laughing real teahot beverage eyes severance severancefinale apple tvplus apple tv applebooks"
"1737","s1_1737","severance best show tv rn"
"1738","s1_1738","severance season finale director ep ben stiller creator dan erickson cliffhanger ending revelations lumon alpha plan season status stiller film bag man"
"1739","s1_1739","sure supposed sleep severance season finale wish luck"
"1740","s1_1740","severence severance helly apple tv friday"
"1741","s1_1741","severance finale fire love show"
"1742","s1_1742","just watched episode severance severance tvtime"
"1743","s1_1743","severance best new show rn easily"
"1744","s1_1744","severance got best show grace viewing eyes years holy hell finale incredible cant stop thinking severance"
"1745","s1_1745","going say wish writer option severance innie takes writes scripts know real world distractions realized probably came show begin"
"1746","s1_1746","severance nailed landing brilliant episode season pressure get season like month two great face tears joy srsly though amazing work everyone involved wait see story goes severance"
"1747","s1_1747","severance holy shizznit major propers everyone involved glorious mindfuck innie seeks permission watch season weekend"
"1748","s1_1748","need season severance already"
"1749","s1_1749","severance star britt lower helly shocking reveal season finale via thedailybeast"
"1750","s1_1750","holy cow tense min television severance severancefinale whole season masterclass storytelling cinematography production design acting"
"1751","s1_1751","feel way west world season beyond will absolutely love severance"
"1752","s1_1752","basically watching sonic movie coming home watch severance season finale"
"1753","s1_1753","omg sleep rest hour shift tomorrow stay watch season finale severance"
"1754","s1_1754","hey cobel will season severance"
"1755","s1_1755","waffle partying face severancefinale definitely waffleparty waffle partying face worthy ok hand medium skin tone ifykykgrinning squinting face severance severence apple tvplus apple tv apple books"
"1756","s1_1756","liked twin peaks maniac west world season lol run walk watch severance"
"1757","s1_1757","wow season finale severance next season better next week"
"1758","s1_1758","please watch severance great show never needed second season bad"
"1759","s1_1759","severance season one perfection maybe best opening season show ever seen"
"1760","s1_1760","best new show seen years severance apple tv just watched season finale looking new show binge enjoy cerebral drama thriller light horror will likely enjoy show pops humor brilliant"
"1761","s1_1761","sever til season premiere please severance"
"1762","s1_1762","severance best show year remotely close"
"1763","s1_1763","mean just supposed go living lives like anything matters except getting see severance season"
"1764","s1_1764","ok finally got sucked watching tv series year break watching tv apple tv severance first episode first season really strange since generally like strange trust strange different way will give go"
"1765","s1_1765","need severance season immediately oh god mf season finale exploding head"
"1766","s1_1766","us trying get season severance tonight finale"
"1767","s1_1767","deadline severance season finale director ep ben stiller creator dan erickson cliffhanger ending revelations lumon alpha plan season status stiller film bag man"
"1768","s1_1768","congratulations job extremely well done looking forward season two severance"
"1769","s1_1769","severance severancefinale apple tvplus apple tv artificial intelligence mystery"
"1770","s1_1770","second season severance drops tomorrow right right"
"1771","s1_1771","might greatest season finale time severance"
"1772","s1_1772","severance season finale absolutely amazing can wait"
"1773","s1_1773","great chat severance creator making show video games stellar season finale really happy season turned far favorite show year"
"1774","s1_1774","kidding severance finale twists turns emotions fear exploding head mention performances can top show counting days season"
"1775","s1_1775","congrats great first season severance looking forward high desert smiling face sunglasses"
"1776","s1_1776","season finale severance outstanding"
"1777","s1_1777","backhand index pointing medium skin tone book version series spoilers winking face thumbs medium skin tone free applebooks green apple books backhand index pointing right medium skin tone bonus content apple tv severance streaming apple tvplus inside will find lumon employee handbook rolling floor laughing things shushing face eyes"
"1778","s1_1778","apple tv bringing back critically acclaimed workplace thriller severance second season hr"
"1779","s1_1779","motherf cking season finale severance exploding head"
"1780","s1_1780","praise kier severance renewed second season felt like heart going beat way rib cage minutes finale way short way"
"1781","s1_1781","almost wish severance skip wait season wow"
"1782","s1_1782","severance season potential release date cast plot everything need know"
"1783","s1_1783","severance season twist ending explained lumon sinister scheme revealed"
"1784","s1_1784","severance last days ptolemy grey best two tv shows watched past year apple tv highly recommend"
"1785","s1_1785","severance apple tv one mind boggling shows ever watched highly recommend season finale stressed can wait season"
"1786","s1_1786","severance season finale director ep ben stiller creator dan erickson cliffhanger ending revelations lumon alpha plan season status stiller film bag man"
"1787","s2_0001","ted lasso terrible season severance looks"
"1788","s2_0002","severance season finale just won oscars living room btw"
"1789","s2_0003","sorry better shows apple tv severance"
"1790","s2_0004","severance good ah highly recommend now show watch"
"1791","s2_0005","season finale severance pissed much"
"1792","s2_0006","severance"
"1793","s2_0007","dressed miss huang attend severance panel paleyfest paleyfest harmonyday trader margs nationalmemoryday"
"1794","s2_0008","maniacs among us may necessary get chronological edits severed character innie outie points view wait season severance"
"1795","s2_0009","shot series severance"
"1796","s2_0010","severance show written like dream someone coma like kevin finnerty thing sopranos entire show"
"1797","s2_0011","severance favorite tv show guy dancing hilariousface tears joy"
"1798","s2_0012","severance great show just putting"
"1799","s2_0013","never shocked life thank whoever set also justice zach cherry severance"
"1800","s2_0014","gonna invent severance procedure can walk basement record video telling rewatch show re sever times part can feel frolic woe malice dread show"
"1801","s2_0015","severance season hate forced"
"1802","s2_0016","severance season finale recap season news"
"1803","s2_0017","definitely dumbest way end season great show waste time watching will just piss goodbye severance severance finale apple tvplus"
"1804","s2_0018","severance full season review"
"1805","s2_0019","rewatched first episode severance good first episode tv show fun mark jump just consider innie different person wonder can even convince kill even think real"
"1806","s2_0020","severance season finale just ruined mood rest year fuqq dem innies"
"1807","s2_0021","silo severance spirited awesome really need check rest"
"1808","s2_0022","severance officially renewed season"
"1809","s2_0023","editing end severance season finale cool lol love vibe"
"1810","s2_0024","need severance immediately loudly crying face clapping hands medium light skin tone"
"1811","s2_0025","severance finale left us craving many threads unravel can wait see take mind bending story next season"
"1812","s2_0026","although agree politics blown away severance wow bro just wow finally someone makes show can compete inception movie kudos"
"1813","s2_0027","just dawned severance mystery box show like lost xfiles manifest explains like partying face"
"1814","s2_0028","anyone get enough milchick mad moves season severance"
"1815","s2_0029","going kill season finale severance stupid hell season better good stopping watching season total yawn"
"1816","s2_0030","one pandemic two historic hollywood strikes three year gap seasons later apple tv confirmed third season friday"
"1817","s2_0031","severance greatest series watched life"
"1818","s2_0032","just finished severance season finale speechless"
"1819","s2_0033","now coming severance season finale life wild"
"1820","s2_0034","severance aftershow stars break mark gemma ending mr milchick dance"
"1821","s2_0035","outie loved severance season"
"1822","s2_0036","maybe satisfactory just think lot way tv show structured thinking severance since first episode knew gemma tortured since chikhai bardo"
"1823","s2_0037","less sympathy nature twitter posting lot discuss argue wrt nature severance much say gemma especially still really know going sucked evil will see next season"
"1824","s2_0038","nah severance season finale just pissed face tears joy"
"1825","s2_0039","can one praying severance series reaction loudly crying face severance appletv"
"1826","s2_0040","crazy season severance actually really good cuz season disappointing kept hoping get better whole thing garbage especially last half making wonder ever good begin"
"1827","s2_0041","severance show decade"
"1828","s2_0042","severance star explains gemma heartbreaking reaction season finale"
"1829","s2_0043","aunt gave gag gift every now take tonight used take apple tv closest oomf house watch severance loudly crying face"
"1830","s2_0044","severance finale masterful beyond anything thought happen magnificent storytelling ending note made say show right show think will recover loudly crying face"
"1831","s2_0045","thankful people finally getting severance getting flowers deserves yes"
"1832","s2_0046","season finale severance"
"1833","s2_0047","severance season finale going hail kier"
"1834","s2_0048","severance legit worst show ever watched"
"1835","s2_0049","severance finale stuck landing great combination joy darkness seeing characters work together loved ending can wait season thank dan erickson"
